 Question,Answer,Context,Intent,Entities,Difficulty,Volatility Level,Comments
Am I suppose to upload the NDA even tho I haven't sign on to a project as yet..I'm attending the open house Saturday... I see deadline to sign is today,"You have to do it before meeting with the industry sponsors

Just one copy. They are alternatives",NDA Signing,NDA Inquiry,"NDA, Open House",1,1,
Is the private channel for each team on discord with the TA is already created?,"CISCO private channels with the TAs were created yesterday. 
The startup private channels will be created by the end of the day.",Project Logistics,Discord inquiry,"Discord, Cisco",2,3,
I can’t locate Weston hall,[Map of NJIT Campus],Class Meeting,Class Location Inquiry,"Weston Hall, NJIT Map",1,1,
It’s hard to find Weston Hall my gps took me to the Archie building,"correct
Just enter that building and it’s two floors down",Class Meeting,Class Location Inquiry,Weston Hall,1,2,
Operations is rde systems at the open house ? I am virtual and I don't think they presented.,They will be here on Tuesday,Open House,Open House Inquiry,,1,2,
"I applied to college-success-coaches-website-and-content-creation, but they have not presented today. are they going to be on tuesday?",They will be here on Tuesday,Open House,Open House Inquiry,,1,2,
What do we do if the 2 company’s we picked haven’t scheduled interviews for us or have already filled the role we were applying for? Could we pick a different company?,"If the company has already chosen other students, then you may delete that application and apply to another company",Track Interview,Project Approvals,,1,1,
"if we are approved for one of the sponsors and we are virtual, and we commit in the #industry-team-commitment <#1192185224415690874> channel, last step: how do we take the picture since we are virtual?",New update: please send a photo of yourselves in front of a white wall and send it to #pictures channel,Virtual Approval,Virtual Approval Inquiry,"Photos, Discord",1,1,
"so I am good to leave the openhouse correct? I got approved, and commited",You can leave the webex!,Open House,Open House Inquiry,Webex,1,1,
Is case medical going to be at the open house on tuesday?,We unfortunately do not have any confirmation yet if Case Medical will be present on Tuesday.,Open House,Open House Inquiry,,2,3,
Any update on verizon as well?,"Unfortunately, it is the same situation with Verizon. No confirmation on their presence on Tuesday yet.",Open House,Open House Inquiry,,2,3,
"If the Tuesday Verizon group shows up, could I resubmit my application there? I was told to delete so I could interview with other sponsors","If you do not get approved to any project today, then you may send additional applications for the Tuesday open house. If you want to delete an application today and submit one for another project you may also do so",Project Applications,Application Inquiry,,1,2,
Yeah like if we do two applications today does that mean we aren't allowed to continue applying on Tuesday?,"If you do not get approved to any project today, then you may send additional applications for the Tuesday open house. If you want to delete an application today and submit one for another project you may also do so",Project Applications,Application Inquiry,,1,1,
"Operations may we have an updated list of all sponsors that will show up on tuesday. From my understanding some of them will not show up because they're full. This would help us a lot in re submitting application for certain project, as some of us we not able to be approved",yes we can get that to you after the open house,Industry Route,Industry Open Sponsor Inquiry,Sponsor List,2,3,
Whats the difference with the two industry approval channels on discord? Theres one in the open house section called 'industry-team-commit' and another in the commitment after approval section called 'industry-member',"Please use the #industry-team-commit <#1192185224415690874> channel, but if you have already sent it to the other channel you do not need to change it",Capstone Discord,Project Commitment,Discord,1,1,
Would you allow a co-PM in a team. I know I already asked in person but I just wanted written confirmation for my sponsor,"Yes. The PM, however, will be the primary person responsible (especially with progress reports), but the CO-PM must attend all PM meetings and share responsibilities.",,,,,,
Are Thursday students who already committed to a project allowed to attend the second open house if the sponsors assign us to conduct technical interviews during that event,,,,,,,
"Also, I saw that my commitment message was deleted that I sent after seeing my name in the approvals table.I just resent the commitment message. Is this acceptable? I suspect it's because I was approved extremely early (within 3 minutes of interviews beginning, at 3:02 PM), and sent the commitment immediately after",It has been updated. You can check it on the Live Approvals sheet.,Track Commitment,Project Commitment,Discord,1,1,
So does this mean I have successfully committed? It looks the same and says that I am approved,Yes. It does say that you have committed to Jabil.,Track Commitment,Project Commitment,Discord,3,3,too specific in my opinion
Do Thursday students show up to the Tuesday event virtually or the 10th FTF?,"Students without projects (Tues/Thurs sections) are invited to the Main Open House, in-person, at CC Atrium from 5-9PM",Project Applications,Open House Inquiry,,1,2,
"For CISCO students what would be recommended to do, Trello, Jira, or GitHub? And I’m assuming the Google folder should be from the NJIT account?","Up to you. Trello just provides to do; with jira you can do kanban, see timelines, create backlog and sprints; grant charts do the same as jira pretty much.",Project Logistics,Project Inquiry,"Trello, Jira, Github",1,1,
"If we have a project, do we have to show up to Tuesday’s class?","No class Tuesday, the main open house will be taking place in the atrium for students currently without a project",Class attendance,Attendance Inquiry,,2,2,need live data
Do we only choose one of the 3 then?,"These are just most common and suggested. You can find your own as a PM, better if it is smth used in the industry. But before you make your choice, make sure to review Scope and time management example, and midterm. You will see what you will have to have for the submission.",Project Logistics,Project Inquiry,"Trello, Jira, Github",1,1,
is there a list of sponsors that are going to attend the Tuesday Open House?,"TBA soon, still finalizing the lists. Hopefully we can share tomorrow but it'll be up Tuesday morning at the latest",Open House,Open House Inquiry,Brochure,2,3,
Do Tuesday student who got approved for a project gotta attend the open house tomorrow for attendance?,"Nope, if you are committed to a project then you do not need to attend",Open House,Open House Inquiry,,1,1,
Is there an open house brochure for tomorrow's open house?,"yes! Media & Communications is working on it atm, will share it in <#1192185221353840818> and post it to canvas as soon as it's ready",Open House,Open House Inquiry,"Canvas, Brochure",1,2,
should we post our resumes in here for the open house tomorrow or just show them in person?,both,Open House,Open House Inquiry,Discord,1,1,
What about the other sponsors that aren't on the open house brochure? Will they attend virtually or be assigned at a later date,"most of them came saturday and completed their teams. everyone who is listed on the seating chart will be there in person, connective care will be our only virtual sponsor",Open House,Open House Inquiry,Brochure,2,3,
So what would happen to the no show projects? I.E Rutgers medical school and I think Case Medical,"Hi, honestly we haven't recieved any communication for what open house these sponsors wanted to RSVP in. There is a chance they may show up today or communicate later via email but your best bet would be to withdraw those applications and apply to companies that are surely coming to make sure you are matched in a timely manner and have a project.",Open House,Open House Inquiry,,2,3,